CODGP;Año Formación;Mes Formación;Lugar;Nombre Lider;Información Certificada;Página Web;Correo;Clasificación;Área del Conocimiento;Programa Nacional;Programa Nacional 2;Plan de trabajo;Estado del Arte;Objetivos;Retos;Visión
COL0154771;2008;1;BOGOTÁ, D. C. - BOGOTÁ, D.C.;RAUL ANTONIO TORRES SALAMANCA;Si el día 2014-01-16;;raul.torresescuelaing.edu.co;;Ciencias Sociales -- Economía y Negocios;Ciencia, Tecnología e Innovación en Ciencias Humanas, Sociales y Educación;No Aplica;El plan de trabajo del grupo se desarrolla en las tres líneas de investigación. Se determinan los meses y metas esperadas.1. Linea de Competencias del Administrador:En el semillero sobre Tendencias y necesidades en el campo de la administración se busca estudiar a lo largo de tres ańos, las tendencias y las necesidades internacionales, nacionales y locales en el ámbito de la administración. Se tienen los objetivos específicos de: a. Estudiar las evaluaciones, prospecciones y proyecciones hechas en el exterior, en el país y en los niveles locales sobre las necesidades de profesionales en la administración y sus perfiles y, b. Estudiar tanto las características consolidadas como las innovadoras de los proyectos de formación en diferentes ámbitos geográficos y, en distintas expresiones de formación. Identificar las tendencias que se observan en los primeros y en las últimas y, los elementos de diferenciación y particularización.2. En la línea de mejores prácticas, se adelantan las actividades a un ańo en el proyecto de investigación conjunta con Ecitrónica y la firma OSP Ltda financiado por Colciencias en el contexto de la convocatoria 562.Al mismo tiempo, se seguirá adelante con nuevos trabajos de grado que analicen los acontecimientos en este campo y sus repercusiones.Se adelanterán los trabajos previstos a tres ańos en el Semillero de Medición del Desempeńo Empresarial.3. Se adelantará la investigación sobre Comercio Intraindustrial en los próximos dos ańos y los trabajos en el semillero sobre industrialización, organización y expansión empresarial en Corea del Sur en el curso de tres ańos.;Competencias: En el ámbito del tratrado de Bolonia y como consecuencia de la búsqueda de la movilidad y el reconocimiento del título, en Europa se inició en el ańo 18998 una investigación sobre las competencias de los profesionales europeos. En el ańo 2005, 18 países de América Latina decidieron realizar la investigaicón en sus países con el propósito de construir currículos que enfaticen los puntos comunes pero que también respeten las diferencias de las distintas culturas. Para ello, se evaluaron las competencias europeas y se adapataron a la realidad latinoamericana y se desarrolló la investigación en estos países, tomando como base algunas de las profesiones que se valoraron en Europa. Para el programa de Administración, Colombia fue representada por la Fundación Universidad del Norte de Barranquilla y por la Universidad EAFIT de Medellín. En América Latina se hizo una consulta sobre las competencias genéricas con una respuesta de 9.000 encuestas aproximadamente, y luego se aplicaron aproximadamente 2.500 encuestas para las competencias específicas. Las respuestas de la encuesta calificaron la importancia de dichas competencias en un rango de 1 a 4 y se le pidió a los encuestados que ordenaran según su concepto las cinco primeras competencias generales. Para Colombia.Como resultado de este estudio, se publicó en el ańo 2007 el libro Reflexiones y perspectivas de la Educación Superior en América Latina.Buenas prácticas: Las buenas prácticas empresariales han ido tomando especial auge en los últimos ańos, teniendo publicaciones sectoriales, a partir de procesos de observación directa sobre las acciones que realizan las empresas. en algunas universidades colombianas, se ha puesto énfasis en el tema de la historia empresarial y en el levantamiento de casos que han concluido en eventos internacionales. Estas investigaciones han tomado empresas que se destacan en el medio, pero su enfoque se ubica en el caso o la historia que permita presentarse como ejemplo.;Objetivos.El objetivo general es el de la investigación aplicada y la prestación de servicios de indagación, innovación y especializados en el ámbito empresarial y del desempeńo y la interacción económica, comercial, administrativa y financiera entre las empresas y entre estas y su entorno económico, social y financiero.Objetivos específicos son:- Hacer investigación aplicada en los ámbitos de la administración, el comercio y las finanzas en los entornos nacional e internacional.- Fortalecer la capacidad de determinar y evaluar las condiciones de acceso a los mercados internacionales de empresas y productos mercancías y servicios colombianos.- Identificar, estudiar y evaluar las prácticas empresariales, en particular en las Pymes y, a partir de las mismas construir técnicas y metodologías de gestión por aeas funcionales para aplicarlas en la gerencia de empresas con el fin de potenciar la competitividad de las empresas colombianas. - Con base en metodología inductiva, identificar desarrollos conceptuales alcanzados por la gestión de empresas , organismos y organizaciones en Colombia.- Investigar permanentemente las necesidades y tendencias en Colombia y en el exterior en la formación en ciencias y técnicas de los ámbitos de los negocios.- Investigar los modelos empresariales y de desarrollo y fomento de las empresas y los negocios en el exterior, los factores de éxito, y sus determinantes.- Estudiar y evaluar las diversas manifestaciones del comercio exterior de Colombia, su desenvolvimiento, efectos y determinantes.- Estudiar e investigar la interacción entre los fenómenos y entornos nacionales e internacionales y las empresas, sectores y agregados de actividad económica.- Formar estudiantes y jóvenes investigadores rigurosos.;1. Generación de metodologías aplicables en las Pymes a partir de las buenas prácticas empresariales por áreas funcionales de tal manera que se pueda potenciar la competitividad de las empresas colombianas. Se espera generar 5 metodologías, un apor área funcional, en los próximos 3 ańos.2. Generar conocimiento a través de metodología inductiva, de tal manera que se identifiquen los desarrollos conceptuales alcanzados por la gestión colombiana. Se espera producir 3 libros en los próximos 3 ańos.3. Generar conocimiento sobre los procesos formativos exitosos de los administradores en Colombia.;Misión:Ser punto focal para la convergencia de académicos, estudiantes, investigadores y empresarios con miras a indagar, evaluar y fortalecer el conocimiento sobre el sector empresarial, sus prácticas y desempeńo, el comportamiento de los agregados resultado de la actividad empresarial y la relación entre las empresas y los sectores con el medio ambiente económico y social nacional e internacional. Visión:Al adelantar sus trabajos de investigación aplicada, el Grupo de investigación se distinguirá por su solidez en el conocimiento de los temas objeto de su actividad e interés, por su seriedad y profundidad de análisis y por los aportes conceptuales, experienciales y de metodología que hará a las empresas, a los sectores, a los gremios, al medio académico, al estado y al país.
COL0009912;1995;3;VALLE DEL CAUCA - CALI;MARIO ALEJANDRO PEREZ RINCON;Si el día 2017-06-30;http://cinara.univalle.edu.co;mariela.garciacorreounivalle.edu.co;B con vigencia hasta 2019-12-05 - Convocatoria 781 de 2017;Ciencias Naturales -- Ciencias de la Tierra y Medioambientales;Ciencia, Tecnología e Innovación en Ciencias Humanas, Sociales y Educación;Ciencia, Tecnología e innovación en Ambiente, Biodiversidad y Hábitat;La reducción del tamańo del Estado, los procesos de descentralización y la dinámica globalizadora han tenido una profunda incidencia en el Sector de Agua Potable y Saneamiento y en la Gestión del Recurso Hídrico en general. Como resultado de estos procesos, en la mayoría de los departamentos del país se terminaron las empresas de orden departamental que administraban los servicios de las ciudades medianas y pequeńas y el Programa de Saneamiento Básico Rural que atendía a las localidades menores de 5.000 habitantes. Paralelo a esta situación se inicia un fuerte proceso de privatización en las ciudades medianas y grandes. En estas condiciones se crea un amplio espacio de trabajo para Universidades, ONGs, y diferentes tipos de organizaciones, porque aparecen como responsables de la prestación de los servicios los gobiernos locales, quienes tienen poca tradición en este tipo de función, carecen del apoyo institucional requerido y aparte de todo, ahora tienen que atender a numerosas comunidades rurales y urbano-marginales que venían administrando sus sistemas con fuerte tutela por parte del Estado. Por otra parte, con relación al manejo del recurso hídrico éste está determinado en buena medida tanto por el marco institucional en que está inserto como por la dinámica económico-social de la región y el contexto económico y político del país frente al mundo. Ello hace que las políticas e instrumentos que se diseńen para la gestión integral del recurso hídrico deban tener muy en cuenta estos escenarios en la búsqueda del desarrollo sostenible. El Grupo centra su atención por un lado en el fortalecimiento de la Gestión Comunitaria de Sistemas de Abastecimiento de Agua y Saneamiento pero también apoya el fortalecimiento de una cultura institucional participativa en la relación con los usuarios de las Empresas Prestadoras de Servicios Públicos de ciudades pequeńas, medianas y grandes y las zonas urbano-marginales de estas últimas. Igualmente, actúa en el diseńo y puesta en;En Colombia como en la mayoría de los países de América Latina los mayores problemas en cuanto a cobertura, gestión y calidad de los servicios de agua y saneamiento se concentran en las poblaciones rurales. De ahí que los esfuerzos realizados desde el instituto Cinara se concentren en la cualificación de la participación y la gestión de las comunidades de estas zonas. A esta área de investigación no se le había dado mayor importancia antes de la Decada del Agua y el Saneamiento 1981 -90. Al finalizar la Década, en la Evaluación llevada a cabo en New Delhi, 600 participantes de 115 paises seńalan el impulso a la gestión comunitaria como una de las prioridades para superar los problemas que persistían. Es así como la Declaración de Dublín 1992 establece que la gestión del agua debe colocarse en el nivel más bajo posible. Esto ligado al cambio de orientación de los gobiernos de proveedores de servicios a facilitadores de procesos abre un amplio espacio para realizar un trabajo que redunde en beneficio de los miles de comunidades rurales que administran sus servicios. A partir de la realización del evento From Systems to Service: Scaling up Community Management La Haya, 2001 y de la Conferencia Electrónica, desarrollada entre el 3 de Junio y el 12 de Julio del 2002, en idioma ingles, un amplio grupo de instituciones orientadas al Desarrollo en Africa y Asia ha manifestado su interes en constituir una red de organizaciones que trabajen el tema. En el momento los modelos de gestión y de las relaciones entre comunidades, sector privado y estado ocupan el mayor interes de los investigadores.A nivel nacional la mayor dinamización en cuanto a esta área la ha realizado el Ministerio de Desarrollo con su proyecto Organicemos nuestra empresa y el Programa Cultura Empresarial.;Fortalecer las líneas de investigaciónCrear mecanismos agiles de interacción entre la universidad y las comunidades.Fortalecer la formación del talento humano vinculado al grupo.;Fortalecer la Asociacion Colombiana de Organizaciones Comunitarias Prestadoras de los Servicios de Agua y Saneamiento de Colombia- AQUACOLDifusión masiva del nuevo conocimiento generado por el Instituto y por otros institutos del mundo sobre gestión comunitaria en un lenguaje al alcance de las comunidades y los gobiernos locales.Consolidar una estrategia para el desarrollo de una cultura organizacional participativa con enfoque de genero en las empresas medianas y grandes de servicios públicos que permita establecer relaciones horizontales con los usuarios y desarrollar procesos de aprendizaje;Seremos un grupo que ha consolidado su identidad al interior del Instituto Cinara e irradia los resultados de sus investigaciones en la docencia, las instituciones y las comunidades. Los resultados son conceptuales, metodológicos e instrumentos operativos que permiten cualificar la gestión comunitaria en los asentamientos rurales y fortalecer una cultura institucional participativa de las empresas prestadoras de servicios públicos en las ciudades pequeńas, medianas y grandes. El grupo ha desarrollado una infraestructura de difusión masiva de conocimiento.
COL0058096;2007;1;BOGOTÁ, D. C. - BOGOTÁ, D.C.;DIEGO ALEXANDER GARZON ALVARADO;Si el día 2016-02-08;http://www.ibun.unal.edu.co/lineasGrupos/BiotecnologiaSalud/LG_BS_Reactivos.html;dagarzonaunal.edu.co;;Ciencias Médicas y de la Salud -- Medicina Clínica;Ciencias Básicas;Biotecnología;A continuación se presenta el plan de trabajo del grupo de investigación, partiendo de las metas previstas, las cuales serán alcanzadas a través de la ejecución de proyectos de investigación con productos esperados durante su periodo de duración.Metas:1.Generar nuevo conocimiento2.Formar recurso humano__________Proyecto 1: Evaluación del efecto de la estimulación con campos eléctricos sobre condrocitos cultivados en monocapa.Productos:1. Trabajo de grado de Maestría2. Artículo de investigaciónFinanciación: Participará en la convocatoria de la Dirección de Investigación Sede Bogotá DIB de la Universidad Nacional de Colombia y en las convocatorias de Colciencias.Duración: Corto Plazo 2011-2014___________Proyecto 2: Efecto del ultrasonido en las etapas simplificadas de reparación del ligamento.Productos:1. Tesis de Doctorardo2. Artículo de investigaciónn Financiación: Participará en la convocatoria de la Dirección de Investigación Sede Bogotá DIB de la Universidad Nacional de Colombia y en las convocatorias de Colciencias.Duración: Mediano Plazo 2012-2016_____________Proyecto 3: Efecto de las cargas mecánicas sobre el desarrollo de la epífisis y la placa de crecimiento del fémur etar los objetivos y proyectos del corto y largo plazo. Catatumbo, una región hacia donde apuntan muchas miradas, muchos proyectos de muchos matices, intereses nacionales e internacionales es esta zona la que representa el futuro de la región y el grupo de investigación puede aquí dejar su huella. la que representa el futuro de la región y el grupo de investigación puede aquí dejar su huella.;A continuación, se presenta una revisión sobre la mecanobiología de tejidos y órganos, elaborada por Landínez, N., Garzón-Alvarado y D., Narváez, C 2011 integrantes del grupo de investigación.La mecanobiología computacional, determina las reglas cuantitativas que gobiernan las acciones celulares para su expresión, diferenciación y mantenimiento ante estímulos biológicos y mecánicos, las cuales pueden simularse mediante métodos numéricos. El procedimiento para hallar dichas reglas es habitualmente mediante el proceso de prueba-error. Los ensayos computacionales se simulan a partir de problemas de valor en el contorno mediante los cuales, las cargas mecánicas sobre el contorno son trasladadas a variables mecánicas locales deformaciones y tensiones. Del lado biológico, estas variables mecánicas locales o biofísicas estimulan la expresión celular para regular, por ejemplo, la composición de la matriz y la expresión de sustancias moleculares. Tanto la parte biológica como la mecánica se combinan en un modelo computacional, que considera la aplicación de fuerzas, mecanotransducción, expresión celular, genética y la transformación de las características de la matriz extracelular. El método usual de implementación numérica de estos problemas mecanobiológicos es el método de los elementos finitos.A diferencia de los problemas tradicionales de la ingeniería, donde el cálculo numérico produce una respuesta a un fenómeno conocido, en la mecanobiología se ensayan diferentes relaciones matemáticas, variables de entrada y estímulos biofísicos para simular el comportamiento de un tejido u órgano. De esta forma se establecen hipótesis, y la simulación permite verificar si es plausible en comparación con las evidencias experimentales existentes que muchas veces son incompletas e insuficientes para verificar, sin duda alguna, las hipótesis de partida, abriéndose entonces nuevas vías de experimentación. Continúa... NO permite introducir más texto;Objetivo GeneralGenerar nuevo conocimiento a partir de la resolución de problemas propios de las ciencias de la salud relacionados con el comportamiento mecánico y biológico de los tejidos y órganos del cuerpo humano haciendo uso de métodos computacionales y experimentales.Objetivos Específicos1. Formular proyectos de investigación en el área de las ciencias de la salud bajo el enfoque mecanobiológico.2. Formar recurso humano para la generación de nuevo conocimiento.3. Producir impacto académico en el nivel nacional e internacional.;1. Generar impacto en ámbitos adicionales al académico. Específicamente, establecer una relación directa con la clínica, lograr validar los resultados computacionales y experimentales en humanos.2. Apoyar la creación de programas de formación. Es evidente la escasez de Programas de formación doctoral en el país. 3. Continuar la financiación de los proyectos de investigación existentes y próximos. Actualmente, el grupo está siendo beneficiado por la Dirección de Investigaciones sede Bogotá de la Universidad Nacional de Colombia a través de la convocatoria del programa nacional de proyectos para el fortalecimiento de la investigación, la creación y la innovación en Postgrados de la Universidad Nacional de Colombia 2013-20154. Continuar con la creación de redes de investigación. Actualmente, se está apoyando la formación de doctorado a través de la co-dirección del mismo, trabajo que viene desarrollándose en conjunto con el Instituto de Errores Innatos del Metabolismo de la Universidad Javeriana.;El grupo de investigación de mecanobiología en tejidos y órganos espera ser consolidado y reconocido nacional e internacionalmente por sus logros científicos en la resolución de problemas propios de las ciencias de la salud relacionados con el comportamiento mecánico y biológico de los tejidos y órganos del cuerpo humano haciendo uso de métodos computacionales y experimentales..
COL0025148;2012;1;BOGOTÁ, D. C. - BOGOTÁ, D.C.;CRISTHIAN FABIAN RUIZ RAMOS;Si el día 2017-06-28;www.rringenieria.com;gerenciaestrategicarringenieria.com;C con vigencia hasta 2019-12-05 - Convocatoria 781 de 2017;Ingeniería y Tecnología -- Otras Ingenierías y Tecnologías;Ciencia, Tecnología e Innovación en Ciencias Humanas, Sociales y Educación;Ciencia, Tecnología e innovación en Ambiente, Biodiversidad y Hábitat;En 2014 registrar un producto de nuevo conocimiento en coautoría con investigadores latinoamericanos.;Aqui presentamos el estado del arte del grupo RR Conocimiento e Innovación;Los objetivos del grupo son:Desarrollar proyectos de investigación en Inteligencia competitiva y de mercados sectorial y territorial.Realizar procesos de formación de los integrantes del grupo en áreas de Planificación y direccionamiento estratégico organizacional.Diseńar estrategias orientadas a la planificación e implementación de acciones que integren las dimensiones ambiental, competitividad y de planificación estratégica;Los retos para el grupo son:Generar trabajo en RED para el desarrollo de proyectos conjuntos.Desarrollar proyectos de investigación en conjunto con empresas para el diseńo de prototipos.;En 2019 ser un grupo reconocido a nivel nacional por la calidad de sus productos de investigación y a nivel latinoamericano porque sus proyectos potencian el trabajo en Red.
COL0029245;2014;6;BOGOTÁ, D. C. - BOGOTÁ, D.C.;ANIBAL ALFONSO TEHERAN VALDERRAMA;Si el día 2016-04-14;;anibal.teheranjuanncorpas.edu.co;C con vigencia hasta 2019-12-05 - Convocatoria 781 de 2017;Ciencias Médicas y de la Salud -- Ciencias de la Salud;Ciencia, Tecnología e Innovación en Salud;Ciencia, Tecnología e Innovación en Ciencias Humanas, Sociales y Educación;Nos planteamos una estrategia fundamentada en 5 pilares:1. Logística: Se estandarizarán reuniones con una periodicidad mensual, que permitan revisar puntos de chequeo de evolución y desarrollo de las metas individuales y grupales.2. Divulgación: Nos proponemos escribir artículos que muestren los resultados de las investigaciones realizadas y realizar al menos dos presentaciones en escenarios de investigación nacional e internacional.3. Nivel de formación: Todos los integrantes del grupo deberán obtener el nivel de Magister y formación en pedagogía en menos de un ańo, después de tener aval institucional.4. Debemos estar avalados institucionalmente en el segundo semestre del 2015, además clasificados como grupo de investigación formal en una categoría mayor o igual a C en el ańo 2018 y la mayoría de nuestros integrantes deberán estar clasificados como investigador junior en el ańo 2020.5. Los integrantes deben estar en constante actualización con respecto a sus temáticas particulares. 6. El grupo diseńará productos de tipo cursos cortos, de formación en aspectos relacionados con pedagogía e investigación con aplicación en la Medicina y otras Ciencias Básicas. 7.Fomentar la creación, desarrollo y producción de semilleros de investigación con temáticas afines a nuestras líneas de investigación.;null;1. Visibilizar el grupo en escenarios de Epidemiología y Técnicas Estadísticas Aplicadas a la Medicina y la Pedagogía.2. Clasificar el grupo en una categoría que nos permita ser competitivos a nivel internacional.;1. Consolidar investigaciones de punta con grupos de investigación reconocidos académicamente a nivel nacional e internacional.2. Implementar estrategias pedagógicas y didácticas que sean de alto impacto en el estudio de la medicina a nivel nacional.;Nos proponemos como grupo de investigación ser reconocidos tanto en el ámbito nacional como internacional por:La excelencia en nuestros proyectos de investigación.El liderazgo en la investigación e implementación en soluciones alternativas e innovadoras frente a los problemas epidemiológicos, pedagógicos y didácticos en el área de ciencias de la salud.
