CODGP;Año Formación;Mes Formación;Lugar;Nombre Lider;Información Certificada;Página Web;Correo;Clasificación;Área del Conocimiento;Programa Nacional;Programa Nacional 2;Plan de trabajo;Estado del Arte;Objetivos;Retos;Visión
COL0110309;2007;9;BOGOTÁ, D. C. - BOGOTÁ, D.C.;GLORIA MARGARITA VARON DURAN;Si el día 2018-03-04;https://sites.google.com/a/unal.edu.co/cmun_unal/;gmvarondunal.edu.co;A con vigencia hasta 2019-12-05 - Convocatoria 781 de 2017;Ingeniería y Tecnología -- Ingenierías Eléctrica, Electrónica e Informática;Ciencia, Tecnología e Innovación en Tecnologías de la Información y las Comunicaciones;Ciencia, Tecnología e Innovación en Salud;El Grupo de Investigación en Electrónica de Altas Frecuencias Y Telecomunicaciones CMUN enfoca los diferentes proyectos que desarrolla en la solución de problemas que tengan un impacto importante a nivel social e industrial, buscando un equilibrio al mejorar la calidad de vida de las personas y la competitividad del país.Mediante el desarrollo de sesiones de trabajo con académicos e industriales se plantean los diversos problemas que se manifiestan en los procesos de producción al igual que aquellos que afectan a la población. Se define un problema puntualmente y se le da solución mediante un proceso de diseńo, implementación y pruebas de ingeniería y se ratifica ensayándolo en las condiciones por las cuales fue concebido como un problema a solucionar. Posteriormente la evaluación crítica de estos resultados se publica un artículo en un medio de divulgación científica con el fin de compartir la experiencia con otros grupos de investigación del área y encontrar mejoras al trabajo implementado mediante trabajo conjunto con los otros grupos de investigación.;El Grupo de Investigación en Electrónica de Altas Frecuencias y Telecomunicaciones de la Universidad Nacional de Colombia Sede Bogotá inició en 2007 como un grupo de trabajo en el cual convergían los intereses académicos de investigación de un grupo de docentes del departamento de Ingeniería Eléctrica y Electrónica. A partir de estos docentes fundadores iniciaron una serie de investigaciones a nivel de pregrado cuyo resultado fueron inicialmente varios trabajos de grado en temas relacionados electrónica de RF, específicamente en electrónica de microondas y antenas, puntualmente en desarrollo de radares de instrumentación. Luego vienen resultados de interés en el área de identificación por radiofrecuencia RFID, de aquí sale otra parte del grueso de los trabajos de grados hechos por el grupo. Varios de estos trabajos en RFID y en electrónica de microondas y antenas han sido presentados como ponencias en eventos de relevancia académica a nivel internacional. Es importante mencionar que a partir de un pryecto en RFID consistente en un maniquí para simulación de medicamentos, se escribió un capítulo de un libro a nivel internacional.A inicios del ańo 2010, el grupo abre dos nuevas líneas de trabajo en alta frecuencia, la primera de ellas es la rama de la optoelectrónica, la cual es relativamente reciente en nuestro país y que viene a darle un nuevo impulso al trabajo del CMUN ya que se proponen trabajos con un fuerte impacto social dado que se busca fortalecer la investigación en transmisión óptica, la cual está directamente relacionada con el acceso de las tecnologías de la información y comunicación a las regiones más apartadas del país. También, nace la línea de procesamiento de seńales, la cual complementa todas las áreas anteriores dado que permite realizar un estudio más profundo más allá de los fenómenos físicos electromagnéticos y se concentra en aplicar toda la electrónica desarrollada en el grupo hacia fines prácticos.;GeneralArticular los trabajos de investigación en las áreas de electrónica de altas frecuencias, telecomunicaciones, sistemas inalámbricos y afines, que se realizan en el Departamento de Ingeniería Eléctrica y Electrónica de la Universidad Nacional, Sede Bogotá.EspecíficosImpulsar el desarrollo científico y tecnológico del país fortaleciendo las líneas de investigación en:1.Antenas y propagación 2 Electromagnetismo computacional 3 Identificación por Radio Frecuencia RFID 4 Ingeniería de RF y microondas 5 Optoelectrónica y Telecomunicaciones Ópticas 6 Procesamiento de seńales en instrumentación, sensado remoto y comunicaciones inalámbricas 7 Sensado remoto, radar y sonar Realizar proyectos a nivel nacional e internacional en las áreas de énfasis del grupo con el fin de integrar las tendencias tecnológicas a nivel regional y mundial.Realizar proyectos con las empresas del país para tener un mejor conocimiento de la problemática actual del sector tecnológico del país y poder contribuir con soluciones y desarrollos de última tecnología.;-Ser un ente generador de conocimiento a nivel nacional e internacional.-Obtener recursos económicos y técnicos que permitan realizar investigaciones de gran envergadura con alto impacto social e industrial.-Viculación con entes privados y gubernamentales enfocados a generar conocimiento y solucionar problemas de ingeniería.;Para el ańo 2018 el Grupo de Investigación en Electrónica de Altas Frecuencias y Telecomunicaciones CMUN será un referente a nivel nacional en el trabajo de dispositivos a alta frecuencia aplicados a la academia y la industria colombiana mediante la prestación de servicios de laboratorio así como el desarrollo de productos.
COL0119137;2011;5;BOGOTÁ, D. C. - BOGOTÁ, D.C.;OSCAR EDWIN PIAMBA TULCAN;Si el día 2016-08-16;;oepiambatunal.edu.co;C con vigencia hasta 2019-12-05 - Convocatoria 781 de 2017;Ingeniería y Tecnología -- Ingeniería de los Materiales;Investigaciones en Energía y Minería;Ciencia, Tecnología e Innovación en Ingeniería;null;null;Desarrollar nuevos conocimientos por medio de investigaciones en corrosión, tribología y materiales para energía, para la construcción en comunidades académicas en el área de ciencia, tecnología y fortalecimiento del vínculo con la industria.;null;null
COL0120979;2011;1;BOGOTÁ, D. C. - BOGOTÁ, D.C.;JAVIER ROSERO GARCIA;Si el día 2017-07-25;www.ing.unal.edu.co/grupos/emd/;jaroserogunal.edu.co;B con vigencia hasta 2019-12-05 - Convocatoria 781 de 2017;Ingeniería y Tecnología -- Ingenierías Eléctrica, Electrónica e Informática;Investigaciones en Energía y Minería;Ciencia, Tecnología e Innovación en Tecnologías de la Información y las Comunicaciones;PROGRAMA1. Sociabilización y Difusión. Meta: 100 Ańo: 2014 -Proyecto: Identificación de los mecanismos de financiación y apoyo a proyectos de investigación universidad - Empresa Indicador: No de productos realizados / No de productos programados Producto:Documento escrito de mecanismos de financiación de proyectos. Procedimientos para establecer la metodología de los mecanismos de financiación de proyectos. -Proyecto: Difusión de los mecanismos de financiación y apoyo a proyectos de investigación universidad - Empresa. Indicador: No de productos realizados / No de productos programados. Producto: Presentación audiovisual que contenga los mecanismos de financiación y apoyo a proyectos de investigación universidad  Empresa. Programa de difusión. Soportes de Ejecución y seguimiento al programa. PROGRAMA2. Acercamiento Universidad - Empresa Meta: 100 Ańo: 2012 -Proyecto: Organización y estructuración de proyectos de investigación potenciales. Indicador: No de productos realizados / No de productos programados. Producto: Definición de proyectos potenciales a desarrollar. -Proyecto: Estructuración de la propuesta de los proyectos de investigación. Indicador: No de productos realizados / No de productos programados Producto: Anteproyecto. Documento con la definición de la propuesta de financiación. Soporte de la presentación ante los entes financiadores. Aprobación de la propuesta.PROGRAMA1. Actualización del conocimiento Meta: 100 Ańo: 2014-Proyecto: Generación del estado del arte de la aplicación de nuevas tecnologías en sistemas eléctricos industriales. Indicador:No de productos realizados / No de productos programados 100 Producto: Estado del arte. -Proyecto: Actualización y aportes a la base de conocimiento de nuevas tecnologías en sistemas eléctricos industriales. Indicador:No de productos realizados / No de productos programados 100 Producto: Actualización del Estado del arte. PROGRAMA2. Proyectos de desarrollo y aplicación indust;El sector eléctrico industrial enfrenta retos en desarrollo y aplicación de nuevas tecnologías que le permita ser más competitivo y acceder a mercados internacionales por medio de productos innovadores y de calidad. Se hace necesario formar profesionales con altas calidades y cualidades junto con la realización de proyectos acordes de desarrollo del país en áreas especificas de control de maquinas eléctricas y aplicación de electrónica de potencia en el sistema eléctrico industrial que derive en proyectos especializados de desarrollo tecnológico e industria sostenible y oportunidad de negocio para las empresas nacionales 1.El estudio de electrónica de potencia y maquinas eléctricas se ha realizado de manera tangencial sin establecer un plan estratégico que permita postular objetivos claros y oportunos de investigación, y desarrollo a largo plazo. Durante los últimos 10 ańos se ha realizado trabajos de aplicación e investigación en electrónica de potencia de forma puntual. Todos estos proyectos han sido independientes buscando solucionar problemas particulares de diferentes grupos de trabajo y no dentro de un esquema organizado y estructurado orientado al fomento, fortalecimiento, divulgación y plan de acción concreto de aplicación de la electrónica de potencia y maquinas eléctricas en el sistema eléctrico industrial, generación de energía renovable y gestión eficiente de energía. Para continuar con el fortalecimiento de las áreas de investigación de electrónica de potencia y maquinas eléctricas se busca establecer un plan estratégico de trabajo en los siguiente cuatro ańos y establecer mecanismos de financiación en proyectos de desarrollo e investigación en la Universidad Nacional de Colombia y en conjunto con las empresas del sector Colombiano que permitirá sumar esfuerzos para potencializar e incentivar la línea de investigación.Electrical Machines  Drives Group EMD busca desarrollar proyectos de investigación y desarrollo en aplicaciones;Los objetivos generales del proyecto de grupo de investigación son:Consolidar grupos de trabajo interdisciplinario para desarrollo de tecnología e investigación en máquinas eléctricas y electrónica de potenciaEstablecer modelos de simulación y sistemas de prueba experimental en máquinas eléctricas y convertidores de potencia que permitan investigar el comportamiento en aplicaciones industriales Nuevas técnicas de sistemas de control para convertidores de potencia y motor eléctricoDesarrollo de técnicas de diseńo y control de sistemas de generación de energía renovableDesarrollar un laboratorio de pruebas para certificación de máquinas eléctricas según normas Internacionales;1. Financiera: sinergia universidad empresa - Objetivo estratégico 1: Gestionar la financiación de proyectos acordes a las líneas de investigación del grupo por medio de proyectos conjuntos Universidad  EmpresaIndicador 1= sumatoria del Numero de proyectos financiados por la empresaMeta 1: al 2013, dos 2 de los proyectos elaborados por el grupo de investigación deberán obtener financiación por la empresa, Al 2015 se deberá haber conseguir la financiación de 7 de los proyectos elaborados.Indicador 2: Numero de smlv en pesos de la financiación de los proyectos del grupo de investigación por la empresa, en el ańo en curso. Meta 2: En el 2012 se debe haber obtenido financiación por un monto mínimo de 185 smlv, En el 2015 por un monto de 400 smlv.2.Procesos internos y clientes: Competitividad e innovación tecnológica.Objetivo estratégico 1: Liderar planes de desarrollo y aplicación de nuevas tecnologías Indicador: No. De proyectos interinstitucionales e interdisciplinarios liderados por el grupo de investigación / No. De proyectos interinstitucionales e interdisciplinarios con participación del grupo de investigación100Meta: Al 2013 liderar el 10 de los proyectos interinstitucionales e interdisciplinarios donde participe el grupo de investigación, al 2015 liderar el 20.3. Dinámica organizacional: Formación y crecimiento Objetivo estratégico 1: Brindar capacitación al personal interno y externo del grupo de investigación Indicador 1:  de cumplimiento del plan de capacitación interno Meta 1: 100 Indicador 2:  de cumplimiento del plan de capacitación externo Meta 2: 100;Al 2020 El grupo de investigación Electrical Machines  Drives, EMD, de la Universidad Nacional de Colombia será líder en investigación y desarrollo de proyectos de sistemas de control de convertidor de potencia y motor eléctrico para sistemas eléctricos industriales del país.
COL0148863;2010;8;BOGOTÁ, D. C. - BOGOTÁ, D.C.;PABLO ENRIQUE RODRIGUEZ ESPINOSA;Si el día 2016-02-26;www.inticolombia.unal.edu.co/;inticol_fibogunal.edu.co;;Ingeniería y Tecnología -- Ingenierías Eléctrica, Electrónica e Informática;Ciencia, Tecnología e Innovación en Ciencias Humanas, Sociales y Educación;Ciencia, Tecnología e Innovación en Tecnologías de la Información y las Comunicaciones;InTIColombia busca generar espacios y escenarios de interconexión que permitan involucrar a la industria, la academia y a la ciudadanía en general en procesos de innovación y emprendimiento, basados en el uso y apropiación de herramientas TIC, con el objetivo de reducir la brecha entre la sociedad y la tecnología, facilitando la ejecución de ideas y proyectos que mejoren las condiciones de vida actuales y que cubran las necesidades del contexto colombiano en aspectos como la salud, la educación y la economía, entre otros.El trabajo estará enfocado en la investigación de los siguientes temas:1. Modelos de Innovación y nuevas prácticas que transformen los procesos y servicios en educación, salud, movilidad y transporte, economía y cualquier otro sector que influya en el desarrollo de la sociedad colombiana.2. Escenarios de participación y democratización del conocimiento.3. Herramientas y mecanismos para aumentar la transferencia tecnológica a la población, 4. Relación Universidad-Empresa, para fomentar convenios, acuerdos y proyectos que beneficien a las dos partes mientras se genera conocimiento y desarrollos útiles para el país. 5. Temas específicos como Ciudades inteligentes, Big Data, Ciudadano digital, Innovación abierta, Diseńo de servicios, Living Labs.;Dentro de las líneas de InTIColombia, uno de sus componentes clave es el desarrollo de estrategias y lineamientos que permitan consolidar y convertir a la ciudad de Bogotá en el escenario óptimo para el emprendimiento en contenidos digitales. Dentro de la gran variedad de contenidos digitales, se priorizaron: Videojuegos, Animación, Aplicaciones Móviles, y de manera transversal se genera acompańamiento en emprendimiento digital, creatividad y modelos de negocio.Hasta el momento, dentro de las acciones que se han generado desde el Vivelab Bogotá, se ha consolidado un modelo de 4 líneas a saber: Aprender, Experimentar, Conectar y Crear.Estas 4 líneas han tenido varios hitos durante el 2014. En el componente aprender, se realizaron talleres y encuentros encaminados a generar conocimiento aplicado en la industria de contenidos digitales anteriormente descrita. A su vez, junto con el Ministerio TIC y Colciencias, se ha liderado el diplomado en Animación AniMadeLab, que ha impactado a más de 10 de ciudades junto con la Red Nacional de Vivelabs.En la línea de experimentar, se han generado encuentros, tipo maratón, en los que durante 2 o 3 días se genera una dinámica en torno a la solución de problemas, mediante prototipos de servicios y productos tecnológicos.A su vez, en la línea de conectar, se generan espacios de discusión y encuentros alrededor de temas que son tendencia en el mundo digital. Estos espacios se caracterizan por no tener una rigurosidad académica en su formato, pero si en el contenido que se quiere debatir.Dentro de la línea de Crear, se han creado 4 aplicaciones móviles dirigidas al sector movilidad, turismo, servicios al ciudadano. Además se está liderando una estrategia de innovación abierta y crowdsourcing.Finalmente, se está creando un videojuego que ayude a la comunidad Kichwa en el municipio de Sesquilé a rescatar el uso de su lengua tradicional y dinamizar experiencias que promuevan su práctica en el entorno social en que se desenvuelv;Vigilar las tecnología TIC a nivel mundial, que permita identificar y prever cambios tecnológicos para aprovechar oportunidades y mercados emergentes para el país. Identificar tendencias tecnológicas para minimizar el riesgo en la toma de decisiones de apuestas tecnológicas en los sectores académicos, empresarial y del gobierno. Formular proyectos de Investigación, desarrollo tecnológico e Innovación de impacto nacional que respondan a las necesidades del país, que aprovechen las ventajas endógenas y las oportunidades identificadas en la vigilancia tecnológica y la identificación de tendencias a nivel mundial. Generación de redes de colaboración e investigación con instituciones privadas y públicas en Colombia y Latinoamérica, en busca de articular las capacidades y ventajas de los aliados para el mejor desarrollo de los proyectos y como mecanismo para difusión de los resultados de las investigaciones Transferir el conocimiento generado en el grupo al sector privado, gubernamental y la sociedad en general.Generar espacios de discusión sobre los usos de las TIC en la educación, la salud y las industrias creativas con actores académicos, de gobierno y empresarios, que sirvan como insumo para la formulación de políticas económicas y sociales, decisiones en cuanto a apuestas de investigación y decisiones de negocio respectivamente.;Generar espacios y escenarios de interconexión que permitan involucrar a la industria, la academia y a la ciudadanía en general en procesos de innovación y emprendimiento, basados en el uso y apropiación de herramientas TIC, con el objetivo de reducir la brecha entre la sociedad y la tecnología, facilitando la ejecución de ideas y proyectos que mejoren las condiciones de vida actuales y que cubran las necesidades del contexto colombiano en aspectos como la salud, la educación y la economía, entre otros.Agrupar conocimiento de diferentes áreas como arte, diseńo, ingeniería, pedagogía, etc, y de esta manera vincular actores del sistema nacional de Ciencia, tecnología e Innovación. Igualmente, pretende intercambiar conocimiento y fomentar espacios de articulación con otras universidades y otros grupos de investigación.Propiciar espacios de colaboración en áreas tecnológicas y áreas complementarias, articulando a los participantes por medio de conferencias, eventos, encuentros y proyectos en general. Se vincularán ciudadanos, estudiantes, profesores, facultades, universidades y empresas interesadas en la ejecución de ideas y proyectos innovadores a través de redes abiertas de trabajo, de convenios y de acuerdos que se establezcan.Promover la internacionalización presentando trabajos, productos, eventos y proyectos, fruto del trabajo de los investigadores del grupo, en eventos realizados en torno a las TIC alrededor del mundo. También promover la realización de prácticas y pasantías en diferentes países con el fin de ampliar la visión y el conocimiento de sus miembros. Igualmente, el grupo busca establecer alianzas con entidades latinoamericanas que permitan trabajar en equipo y difundir los resultados en los países involucrados.;En el 2018, InTIColombia será el nodo articulador más importante de Latinoamérica donde se impulsarán y se promoverán investigaciones, productos y servicios innovadores que resuelvan problemas y mejoren la calidad de vida de las personas en el mercado colombiano y latinoamericano. Será también un dinamizador de la industria del sector TIC, en búsqueda de mejoras competitivas de las instituciones a través del uso de las tecnologías TIC y contribuirá al desarrollo del país.
COL0002439;1999;1;ANTIOQUIA - MEDELLÍN;LUZ MARINA OCAMPO CARMONA;Si el día 2016-01-29;http://;lmocampounal.edu.co;A1 con vigencia hasta 2019-12-05 - Convocatoria 781 de 2017;Ingeniería y Tecnología -- Ingeniería de los Materiales;Ciencia, Tecnología e Innovación en Ingeniería;Ciencias Básicas;Actualmente se estan desarrollando proyectos de investigación finaciados por la sede,por Colciencias y otros en convenio con empresas privadas, dentro de los cuales se ha vinculado tanto a profesores como estudiantes de las diferentes lineas de investigación, Todos estos además han servido para desarrollar trabajos de grado y resolver problemas tanto para la industria como en el conocimiento puro.Se pretende dar continuidad a estos trabajos mediante la formulación de nuevos proyectos de investigación, que permitan avanzar en el conocimiento en las diferentes lineas de investigacón y así poder consolidarlarlas, además esto nos permitirá generar la tencología adecuada y de la cual que no se diponga, en cada caso, para la solución delos diferentes problemas.;Los materiales tienen una estrecha relación con los desarrollos tecnológicos alcanzados por la sociedad. Esto se confirma al analizar los cambios experimentados por ésta en el último siglo la revolución de la información, basada en la radio, la televisión, las diferentes clases de telecomunicaciones, la computación y los sistemas de control tienen como base común el desarrollo del chip de silicio. Los metales y sus aleaciones han evolucionado hacia la optimización de sus propiedades. Los materiales cerámicos, poliméricos y compuestos han revolucionado la industria automovilística y aeronáutica. Los materiales estructurales han evolucionado permitiendo realizar construcciones sólidas, estéticas y resistentes a la corrosión y a los sismos. Otros avances importantes están en las áreas de los biomateriales, la nanotecnología, los microsistemas, etc. La Ciencia e Ingeniería de Materiales es un área fundamental para el desarrollo de industrias competitivas, que son la fortaleza de la economía de un país la solución a muchos de los problemas en la industria se encuentra en la frontera de la investigación de esta área del conocimiento. THE NATIONAL RESEARCH COUNCIL USA reconoció la Ciencia e Ingeniería de materiales como una nueva área estratégica para el conocimiento. La fuerte interrelación entre los cuatro los elementos que definen el campo de Ciencia e Ingeniería de Materiales, es la base para el desarrollo futuro de tal campo:Las propiedades o fenómenos. La estructura y la composición. Síntesis y procesamientoEl desempeńo;Realizar investigación y desarrollo I+D para incrementar el volumen de conocimientos y la creación de nuevas aplicaciones, para incrementar la capacidad tecnológica del país.Capacitar profesores universitarios que incrementen y mejoren el trabajo docente e Investigativo en ingeniería en la región y el país.Fortalecer la interacción Universidad Industria para el desarrollo de estudios e investigaciones y para el intercambio de experiencias en el campo de la ingeniería y en particular de materiales y su procesamientoFormar investigadores en los campos de las líneas de investigación propuesta Procesamiento de Minerales, metalurgia física, Desarrollo de nuevos materiales, Caracterización de materiales, corrosión y protección, reciclaje de Materiales Fortalecer las líneas de investigación en el área de Ciencia e Ingeniería de Materiales que sirven de base al programa de doctorado y al programa de maestría que se desarrolla actualmente.;Generar una aproximación con la industria, con el fin de potenciar sus capacidades tecnológicas para aumentar los indicadores de innovación y por tanto la competitividad.Participar intensivamente en la estructuración del programa pregrado en ingenieria de materiales.Participar intensivamente en la estructuración del programa de doctorado en ingenieria.Actualización tecnológica de los laboratorios mediante la adquisición y desarrollo de euipos y tecnologias.Continuar con la acreditación de equipos, ensayos y procedimientos en el laboratorio de Materiales de la escuela de materiales.Publicaciones en revistas indexadas por COLCIENCIAS que permitan mostrar la producción de grupo a nivel internacional y nacional.;Constituirse en el mediano plazo en un eje de investigación y desarrollo en el área de la Ciencia y la Tecnología de Materiales, promoviendo el trabajo en temas que produzcan resultados que se concreten en la innovación de productos y procesos con valor agregado de conocimiento y que propicien la creación de microempresas de alta tecnología.
