CODGP;Año Formación;Mes Formación;Lugar;Nombre Lider;Información Certificada;Página Web;Correo;Clasificación;Área del Conocimiento;Programa Nacional;Programa Nacional 2;Plan de trabajo;Estado del Arte;Objetivos;Retos;Visión
COL0005762;2002;2;BOGOTÁ, D. C. - BOGOTÁ, D.C.;OMAR FREDY PRIAS CAICEDO;Si el día 2017-07-25;http://www.grisec.unal.edu.co;ofpriascunal.edu.co;B con vigencia hasta 2019-12-05 - Convocatoria 781 de 2017;Ingeniería y Tecnología -- Ingenierías Eléctrica, Electrónica e Informática;Investigaciones en Energía y Minería;Ciencia, Tecnología e Innovación en Ingeniería;Cumplir satisfactoriamente con los objetivos del Programa estratégico SGIE, cobijando al mayor número de industriales posibles.Formulación de nuevos programas estratégicos nacionales.Desarrollo de Tesis de grado de Maestría en las diferentes áreas de investigación.Vinculación de nuevos investigadores de pregrado y posgrado.Publicación de artículos que socialicen los resultados obtenidos en los diferentes proyectos.Participación en seminarios y congresos a nivel nacional e internacional.;El Grupo de investigación nace de las inquietudes del profesor Germán Corredor Avella relacionadas con el debate académico con respecto a la evolución del Sector Eléctrico en el ámbito de la economía energética, la formulación de políticas y el planeamiento inicialmente. Hace alrededor de tres ańos bajo la dirección del profesor Omar Prias, el grupo de investigación amplió su ámbito de estudio a la eficiencia energética en el diseńo de planes y programas de cobertura nacional y sectorial, como también en gestión con impacto en el sector productivo y específicamente en gestión energética en industria y vigilancia tecnológica en empresas del sector eléctrico.;Desarrollar investigaciones y programas estratégicos nacionales en el área de Gestión integral de energía a nivel nacional que contribuyan al óptimo aprovechamiento de los recursos energéticos del país y aporten al planeamiento energético de la nación.Propender por la productividad y la competitividad del sector industrial mediante la reducción de costos de operación y mantenimiento y la inclusión de una estructura administrativa capaz de gerenciar los recursos energéticos.Implementar la metodología de Vigilancia Tecnológica en diferentes áreas del uso final de energía eléctrica, como una herramienta que permite identificar nuevas tendencias tecnológicas para anticipar la toma de decisiones estratégicas que apoyen el avance tecnológico colombiano.;Ser reconocido como grupo de excelencia por Colciencias y otras instituciones a nivel nacional e internacional.Promover la sinergía Universidad  Empresa  Estado para el desarrollo de proyectos y programas energéticos que contribuyan al progreso del país.Liderar planes asociados a la vigilancia tecnológica en el sector energético nacional.;Al ańo 2016 el grupo GRISEC será el líder en investigación y desarrollo de programas estratégicos en el sector energético relacionados con la gestión y la vigilancia tecnológica del uso final de energía. GRISEC también estará constituido como un referente calificado por los organismos gubernamentales encargados de la definición de las políticas energéticas nacionales.
COL0010889;1990;1;BOGOTÁ, D. C. - BOGOTÁ, D.C.;RUBEN DARIO GODOY SILVA;Si el día 2018-05-29;http://;rdgodoysunal.edu.co;A1 con vigencia hasta 2019-12-05 - Convocatoria 781 de 2017;Ingeniería y Tecnología -- Ingeniería Química;Ciencia, Tecnología e Innovación en Ingeniería;Ciencias Básicas;Desarrollar a través de investigación a nivel de Doctorado y maestría procesos para la Industria Química y Biotecnológica del país.Ofrecer alternativas tecnológicas, viables tanto técnica, económica y ambientalmente a la industria química y sociedad colombianas, mediante la generación o adaptación de tecnología.Formar de investigadores de alto nivel que se constituyan en una masa crítica que pueda dar soluciones o alternativas a las necesidades tecnológicas de la industria química y la sociedad.Evaluador permanente de la tecnología usada o potencialmente empleada por la industria química nacional.Colaborador en la Inserción del país dentro del programa de globalización, aprovechando las fortalezas y ventajas comparativas con que cuenta.;Las investigaciones que se están realizando por parte de los investigadores del grupo corresponden a la actualidad nacional e internacional, dentro de las diferentes áreas del conocimiento en las cuales el grupo realiza proyectos de investigación.El grupo lleva a cabo proyectos en las áreas de Energía, Medio ambiente,nuevos productos. Cuenta con 23 investigadores 9 de los cuales cuentan con formación a nivel de doctorado.El grupo ha graduado cinco estudiantes de docotrado y cerca de 50 de maestría. En la actualidad sus integrantes dirigen 15 tesis doctorales y cerca de 20 de maestría.Se han desarrolado equipos y proceso que se encuentrsan en proceso de patente.En los últimos cinco ańos se ha participado en más de veinticinco eventos nacionales e internacionales, con la presentación de más de 100 ponencias.Ha realizado la publicación de cerca de 20 artículos en revistas indexadas nacional e internacionalmente.Ha diseńado 8 asignaturas a nivel de doctorado y 4 a nivel de maestría. Presta asesoría a al industria química, tanto en la parte de análisis como de desarrolo de procesos. En el ańo 2005 solucionó más de 200 solicitudes industriales.;MISION DEL GRUPOContribuir al avance de la Industria Química Nacional, a través de la formación de investigadores de alto nivel y la generación de tecnologías que obedezcan a las necesidades del país y aprovechen sus recursos.;MISION Contribuir al avance de la Industria Química Nacional, a través de la formación de investigadores de alto nivel y la generación de tecnologías que obedezcan a las necesidades del país y aprovechen sus recursos.METAS A CORTO PLAZO Nuestras metas para los primeros cinco ańos del nuevo milenio pueden resumirse en:Crear una masa crítica de gran nivel que pueda responder a las nuevas exigencias del desarrollo tecnológico de la industria química. Para esto esperamos formar seis investigadores a nivel de Doctorado, cada uno liderando un campo del conocimiento en ingeniería química y diez a nivel de maestría, y dirección de 30 tesis o proyectos a nivel de pregrado.Desarrollar a nivel de planta piloto tres procesos con potencial económico, para ser presentados a la industria para su escalado. Basados en los proyectos de las líneas investigación en las cuales trabaja el grupo.Publicar veinte artículos a nivel nacional e internacionalOrganizar cuatro cursos de extensión: 2 en el área de polímeros, 1 en catálisis, 1 en bioprocesosOrganizar y Desarrollar mínimo dos proyectos con la industria. Se tienen contactos con tres industrias.Iniciar la organización que lleve a la creación del Centro de Desarrollo de Procesos;VISIONOferente de alternativas tecnológicas, viables tanto técnica, económica y ambientalmente a la industria química y sociedad colombianas, mediante la generación o adaptación de tecnología.Formador de investigadores de alto nivel que se constituyan en una masa crítica que pueda dar soluciones o alternativas a las necesidades tecnológicas de la industria química y la sociedad.Evaluador permanente de la tecnología usada o potencialmente empleada por la industria química nacional.Colaborador de la Inserción del país dentro del programa de globalización, aprovechando las fortalezas y ventajas comparativas con que cuenta.
COL0000882;1997;6;BOGOTÁ, D. C. - BOGOTÁ, D.C.;MARTHA CRISTINA BUSTOS LOPEZ;Si el día 2017-08-04;http://;mcbustoslunal.edu.co;C con vigencia hasta 2019-12-05 - Convocatoria 781 de 2017;Ingeniería y Tecnología -- Ingeniería Civil;Ciencia, Tecnología e innovación en Ambiente, Biodiversidad y Hábitat;Ciencia, Tecnología e Innovación en Ingeniería;La meta principal de este grupo es desarrollar e implementar métodos biológicos y químicos para el control de la contaminación acuática y utilizarlas en la evaluación de riesgo ambiental para así contar con una herramienta en la toma de decisiones en los planes de manejo del recurso hídrico.Se proponen dos objetivos generales: A corto plazo, el trabajo se orientará al desarrollo e implementación de métodos biológicos para la evaluación de la toxicidad de efluentes industriales y aguas naturales. A mediano y largo plazo, se espera desarrollar un programa para el control de la contaminación del recurso agua, que permita la incorporación de las herramientas desarrolladas en el proceso de toma de decisiones dentro del contexto de la legislación nacional.;El control de la calidad del agua es un problema que día a día cobra mayor importancia, tanto por la creciente contaminación generada por la descarga de residuos domésticos e industriales, como por la reducción en cantidad, ligada a problemas de manejo ambiental de las cuencas. El manejo y control de los recursos hídricos, se hace fundamentalmente mediante la caracterización fisicoquímica de las fuentes de agua, y su posterior comparación con estándares de calidad muchos de ellos establecidos por la Agencia de Protección Ambiental de los Estados Unidos USEPA o la Organización Mundial de la Salud OMS principalmente. Para el control de la calidad del agua en Colombia, el Gobierno Nacional cuenta con la legislación pertinente y se apoya en diferentes instituciones gubernamentales para su aplicación.Los plane de manejo el recurso no incluyen la evaluación de riesgos ecológicos y de salud generados por la creciente descarga de sustancias xenobióticas al medio ambiente.Por las razones anteriormente mencionadas, la Universidad Nacional a través de la Unidad de Ingeniería Ambiental de la Facultad de Ingeniería y del Departamento de Biología de la Facultad de Ciencias, inició en 1990 un programa de investigación orientado tanto a la estandarización de pruebas de toxicidad con diferentes organismos de prueba, como a la evaluación de los efectos tóxicos generados por diferentes contaminantes presentes en aguas residuales industriales, y en agua para consumo. Durante la potabilización del agua por métodos convencionales se generan subproductos peligrosos que pueden constituir un riesgo a largo plazo para la salud de los consumidores, es necesario evaluar otros sistemas que reduzcan la formación de estos compuestos.;El objetivo general del grupo es: Evaluar la calidad hídrica por métodos convencionales métodos físico-químicos y no convencionales boensayos para el control de la contaminación acuática.La línea de Bioensayos tiene como objetivo general, desarrollar e implementar herramientas biológicas para la evaluación del riesgo ecológico mediante la cuantificación de efectos potenciales tóxicos asociados con efluentes industriales y aguas naturalesLa línea de formación de compuestos orgánicos halogenados tiene como objetivo general, Evaluar la formación de subproductos de desinfección en aguas tratadas y la remoción del material precursor materia orgánica natural y los subproductos formados en el proceso de desinfección.La línea de desinfección para diferentes usos tiene como objetivo general, Evaluar métodos no convencionales ozono, radiación ultravioleta, entre otros para la desinfección de aguas con diferentes usos;1. Se espera incorporar una metodología sencilla e integral para evaluar efluentes industriales en la cual se integre el concepto de riesgo ecológico. 2. Se espera contar con un colectivo de pruebas cuyo comportamiento en términos de reproducibilidad, sensibilidad y costos sea coherente para ser incorporado en la legislación nacional.3. Desarrollar una metodología estándar para la determinación de trihalometanos totales4. Establecer nuevos tratamientos para la desinfección del agua;El grupo está realizando un gran esfuerzo para consolidarse dentro de la comunidad académica e investigativa colombiana que permita apoyar y asesorar a otros grupos así como a entidades gubernamentales. Se pretende explorar el desarrollo de nuevas pruebas de toxicidad para la detección de sustancias mutagénicas, y compuestos que produzcan alteraciones endocrinas disruptores endocrinos
COL0021139;1998;10;BOGOTÁ, D. C. - BOGOTÁ, D.C.;ERNESTO CORDOBA NIETO;Si el día 2016-01-14;http://aplicaciones.virtual.unal.edu.co/blogs/dimaun/;ecordobanunal.edu.co;A con vigencia hasta 2019-12-05 - Convocatoria 781 de 2017;Ingeniería y Tecnología -- Otras Ingenierías y Tecnologías;Ciencia, Tecnología e Innovación en Ingeniería;Ciencias Básicas;- Establecer la base teórica sobre los fundamentos en manufactura inteligente y sistemas técnicos cognitivos, técnicas de inteligencia artificial, prototipado rápido 3D printing y modelamiento de sistemas complejos.- Modelar los componentes de la celda experimental con el análisis de las máquinas y manipuladores en cuanto a protocolos de comunicación, herramientas de operación y desarrollo en hardware y software.- Efectuar las simulaciones de los componentes de la célula de manufactura así como la planeación inicial de producción del sistema integrado.- Evaluar el desempeńo de la celda de manufactura bajo el concepto de la fábrica cognitiva con la evaluación de la flexibilidad de mezcla producto y flexibilidad de ruta del sistema de manufactura.;Los sistemas de manufactura actuales integran metodologías de planificación de la producción tales como e-manufacturing manufactura electrónica, manufactura en red, manufactura virtual así como la ingeniería concurrente y el desarrollo integrado de producto y proceso IPPD Integrated product and process development, en conjunto con sistemas de automatización robustos con cierto nivel de flexibilidad, adaptabilidad y capacidad de decisión ésta integración busca un funcionamiento solidario en todos los niveles de la cadena productiva, a pesar de las perturbaciones involucradas.Dada la naturaleza dinámica de los mercados, la tendencia hacia la oferta especializada y personalizada de productos a la medida, con altos los estándares de calidad, seguridad y productividad, implican aspectos de estructuración y control automatizado del proceso de manufactura.La automatización de plantas de manufactura, se ha orientado a la incorporación de inteligencia artificial como los sistemas de manufactura Biológicos Biological manufacturing Systems BMS y Manufactura basada en agentes agent-based manufacturing systems AMS o sistemas Holónicos HMS. El HMS se enfoca en la programación y control de la producción a través de la re-secuenciación de tareas predefinidas por medio de la cooperación entre agentes autónomos distribuidos, dicha cooperación se establece a partir de reglas de decisión lógica difusa, redes neuronales donde los holones representan aspectos del sistema de manufactura como los recursos, las órdenes y el producto. En BMS el enfoque está dado en términos de la autonomía, adaptación y evolución en la re-configuración a partir del aprendizaje por refuerzo reinforcement learning del sistema de producción frente a un entorno interno o externo dinámico e impredecible, los componentes biológicos autónomos como materias primas, herramientas o robots poseen información genética que evoluciona adquiere experiencia durante el ciclo de vida del producto.; Formación de talento humano a nivel de Doctorado, Maestría y Pregrado en Ingeniería de Diseńo de producto y proceso, Diseńo Industrial, materiales alternativos para nuevos procesos de manufactura y automatización experimental. Potenciar la productividad y competitividad tecnológica en diseńo y manufactura para cadenas productivas colombianas. Consolidar la estructuración de trabajo interdisciplinario en investigación aplicada. Implementar red de trabajo en temáticas relacionadas con materiales alternativos y tecnología de prototipado rápido. Desarrollar proyectos en diseńo de producto y proceso, prototipado rápido, manufactura Virtual y de sistemas automatizados y robotizados para manufactura flexible.;Integrar en el Laboratorio Fábrica Experimental LabFabEx laboratorio sala CAM mecatrónica antigua, edificio 407 de la Universidad Nacional de Colombia una célula de producción con base en el paradigma de la fábrica cognitiva para la ejecución, evaluación y transferencia tecnológica de innovación en desarrollo de producto y proceso de manufactura basado en necesidades del sector productivo industrial colombiano.;El grupo de investigación DIMA-UN construirá un escenario tecnológico que brinde real empoderamiento y aporte colaborativo entre dos actores fundamentales -la academia y el sector industrial-, que sin transgredir los límites de identidad y del quehacer propios de cada actor, conduzca a una interrelación dinámica y de compromiso cierto por la innovación de producto y proceso como hecho tangible económico y tecnológico.
COL0010566;2001;5;BOGOTÁ, D. C. - BOGOTÁ, D.C.;OSCAR FERNANDO CASTELLANOS DOMINGUEZ;Si el día 2018-05-24;http://www.biogestion.unal.edu.co;ofcastellanosdunal.edu.co;A con vigencia hasta 2019-12-05 - Convocatoria 781 de 2017;Ingeniería y Tecnología -- Otras Ingenierías y Tecnologías;No Aplica;No Aplica;El plan de trabajo se ha estructurado en tres etapas:Conceptualización: Los trabajos desarrollados durante dos ańos 1997-1999, se centraron en encontrar y proponer a la comunidad académica y empresarial interpretaciones conceptuales de los diferentes tópicos de la gestión innovación, gestión tecnológica, tecnología, transferencia de tecnología, etc, que fueran aceptables y adaptables a las condiciones de nuestro país. 2. Desarrollo de instrumentos metodológicos. Esta etapa se inicia en 1998 y espera culminarse durante el próximo ańo, busca generar metodologías dinámicas para la caracterización de las empresas, que permitan a su vez llevar a cabo procesos de mejormiento organizanizacional. Es aquí donde precisamente se enmarca el proyecto Desarrollo de instrumentos metodológicos para el diagnóstico en gestión tecnológica y empresarial. 3. Implementación y retroalimentación. En esta etapa de la investigación que iniciándose actualmente, se espera implementar las metodologías a PYMES de diferentes sectores. Luego de su diagnóstico y en procesos de construcción colectiva entre los académicos y los ejecutivos de la respectivas organizaciones estudiadas, se deben generar mecanismos y procedimientos para corregir problemas concretos de las empresas y del sector. Para abarcar lo propuesto en este último caso, ha surgido la necesidad de trabajar en temas como Cadenas Productivas, estrategia, medio ambiente y Benchmarking intersectorial, como herramientas de continuidad e impacto.;La gestión constituye un elemento indispensable para dinamizar el crecimiento económico en distintos sectores de la sociedad, por lo cual son necesarias acciones concretas dirigidas a su fortalecimiento, producto del desarrollo científico y tecnológico.La Universidad Nacional de Colombia sede Bogotá, durante las últimas décadas ha venido consolidando grupos de investigación, enfocados al estudio de la gestión tecnológica aplicada a diferentes ámbitos de la vida nacional. En este contexto, funcionan el Programa Universitario de Investigación - PUI en Gestión, así como la Red de Desarrollo Tecnológico. Además, en uno de los programas estratégicos: Presencia Nacional, la Universidad definió como uno de los Campo de Acción Institucional - CAI el de Desarrollo Tecnológico y dentro de éste el campo Ambiental y el campo de la Educación. El propósito de este CAI es proporcionar a la sociedad desarrollos en ciencia y tecnología, que constituyan oportunidades de crecimiento para el país y para su sector productivo. Así mismo, se cuenta con varios programas estratégicos PRES que lo apoyan. Recientemente en la Facultad de Ingeniería se ha creado el Departamento de Ingeniería Industrial, el cual conjuntamente con otras instancias de la universidad, como el Departamento de Gestión Empresarial y la carrera de Administración de la Facultad de Ciencias Económicas, tiene a su cargo el desarrollo académico del conocimiento relacionado con la gestión tecnológica. La actividad del grupo interdisciplinario de Investigación y Desarrollo en Gestión, Productividad y Competitividad la línea se enmarca en los PRES de Competitividad, Productividad Empresarial y Gestión Tecnológica Genética y Biotecnología Producción Limpia y ambientalmente sostenible Gestión del Medio Ambiente y Educación Superior y Sociedad.;Busca ofrecer soluciones que aporten valor agregado al sector productivo público y privado, sirviendo como soporte académico en la ejecución de proyectos de implementación en gestión gerencial y tecnológica, tendientes a fortalecer la interacción entre las tecnologías blanda y dura, así como entre la universidad, la industria y el estado, a partir de su trabajo interdisciplinario, tomando elementos de diferentes facultades y áreas del conocimiento, articulada por proyectos relacionados que buscan continuidad y coherencia;Los alcances se han estructurado en tres tipos de procesos: 1. Conceptualización: Los trabajos desarrollados se han centrado en encontrar y proponer a la comunidad académica y empresarial interpretaciones conceptuales de los diferentes tópicos de la gestión innovación, gestión tecnológica, tecnología, transferencia de tecnología, etc, aplicables a las condiciones de nuestro país. 2. Desarrollo de instrumentos metodológicos. Busca generar metodologías dinámicas para la caracterización de las empresas, que permitan a su vez llevar a cabo procesos de mejormiento organizanizacional. 3. Implementación y retroalimentación. Luego de su diagnóstico y en procesos de construcción colectiva entre los académicos y los ejecutivos de la respectivas organizaciones estudiadas, se busca generar mecanismos y procedimientos para corregir problemas concretos de las empresas y del sector, abordando temas como Cadenas Productivas, prospectiva y Benchmarking intersectorial, como herramientas de continuidad e impacto.;A 2015, el Grupo se habrá consolidado como un interlocutor y referente académico con liderazgo, proponiendo desde la universidad soluciones sostenibles y sustentables para el desarrollo y aplicación de la gestión en los diferentes ámbitos de la actividad productiva y económica. Para ello se enfocarán los esfuerzos en la consolidación de los procesos de formación de sus integrantes en maestría y doctorado en diferentes disciplinas, vinculación de los investigadores en actividades de docencia para la transferencia del conocimiento generado a la comunidad académica, posicionamiento de la gestión de la variable tecnológica como área de trabajo en la Universidad buscando permear este impacto a otros ámbitos, inserción en temáticas novedosas de gestión tecnológica e innovación, apertura hacia nuevos sectores de aplicación, ampliación de la cobertura de influencia trascendiendo del nivel nacional al internacional mediante las iniciativas en redes de trabajo, el desarrollo de estudios en otros países de la región y la divulgación en países no hispanohablantes.
