CODGP;Año Formación;Mes Formación;Lugar;Nombre Lider;Información Certificada;Página Web;Correo;Clasificación;Área del Conocimiento;Programa Nacional;Programa Nacional 2;Plan de trabajo;Estado del Arte;Objetivos;Retos;Visión
COL0022431;2001;2;BOGOTÁ, D. C. - BOGOTÁ, D.C.;RICARDO EMIRO RAMIREZ HEREDIA;Si el día 2018-05-02;www.unrobot.unal.edu.co;unrobotunal.edu.co;C con vigencia hasta 2019-12-05 - Convocatoria 781 de 2017;Ingeniería y Tecnología -- Ingeniería Mecánica;Ciencia, Tecnología e Innovación en Ingeniería;Ciencia, Tecnología e Innovación en Tecnologías de la Información y las Comunicaciones;TÉCNICO:Robots bípedos: implementación de controles reactivos.Robots de exploración: generación de sistemas de navegación robustos.Mediano Plazo:Incursión en el área de telemanipulación y realidad virtual.Investigación en robótica en apoyo a aplicaciones médicas: asistencia en cirugía, diseńo y fabricación de prótesis. ADMINISTRATIVO:Mantenimiento y ampliación del Laboratorio de Automatización de Máquinas y Robótica.Establecimiento de alianzas con la Facultad de medicina.Establecimiento de convenios con grupos e investigadores en el área de robótica en universidades espańolas y brasileras.Acuerdo de cooperación con el programa de Ingeniería Electrónica de la Universidad del Magdalena.;A nivel mundial hoy en día se encuentra una sorprendente variedad de robots en muy diversas aplicaciones, casi todas ellas a nivel experimental, con la salvedad de los robots industriales, cuya presencia en las grandes fábricas de producción en serie es casi imprescindible hoy en día. Así, se encuentran robots aéreos, terrestres, acuáticos, de exploración espacial en tareas tan diversas como intervenciones quirúrgicas, exploración, espionaje, detección de explosivos o simple entretenimiento.Los principales inconvenientes de la movilidad en los robots son causados por un diseńo mecánico deficiente. Por esta razón se intenta promover y apoyar la investigación en este campo, para así obtener diseńos más confiables con los cuales se logre garantizar un nivel adecuado de movimiento. De esta forma se asegura que el robot cumpla a cabalidad con las tareas para las cuales fue pensado, cumpliendo así con las condiciones de robustez y confiabilidad necesarias para el desarrollo de cualquier tarea en el mundo real.A nivel colombiano, la penetración de la robótica es muy baja aún en el entorno industrial. Así, el campo de aplicación del trabajo desarrollado por el grupo aún es muy amplio y ofrece alternativas muy interesantes para la solución de problemas particulares del país mediante el uso de máquinas automatizadas o de robots.;General:Apropiar teórica, técnica y experimentalmente los conceptos y saberes involucrados en el área de la robótica que permita implementar, diseńar y/o construir máquinas automatizadas y robots de tipo móvil o industrial para solución de problemáticas específicas en el contexto nacional e internacional.Específicos:Diseńo e implementación de plataformas robóticas móviles, desarrolladas para investigación o solución de problemas tecnológicos concretos a nivel nacional o internacionalInvestigación y desarrollo en el campo de los robots en aplicaciones y entornos industriales, adaptados principalmente a los requisitos de robotización en la industria colombiana.Creación y adaptación de maquinaria industrial para producción automatizada en el entorno industrial colombiano.;Corto Plazo:Adecuación física del Laboratorio de Automatización de Máquinas y RobóticaAdquisición de un robot tipo antropomórfico para experimentación en robótica industrial.Mediano Plazo:Incursión en el área de telemanipulación.;El trabajo base del grupo se ha enfocado durante estos ańos a la generación del capital humano y material requerido para el desarrollo de la línea de robótica en la Facultad de Ingeniería de la Universidad Nacional. El grupo debe convertirse en un ente capaz de atender las necesidades puntuales de automatización de la industria y sociedad colombiana, mediante la captación de recursos de investigación tanto en el sector público como privado, y debe aportar soluciones a estas problemáticas con buen desempeńo de tiempo, eficiencia, costo y calidad. La visión a largo plazo tiene su punto de mira en la creación del Instituto Colombiano de Robótica, que apoye las labores en este campo tanto al interior como al exterior de la Universidad Nacional de Colombia.
COL0039279;2003;7;BOGOTÁ, D. C. - BOGOTÁ, D.C.;NESTOR Y ROJAS ROA;Si el día 2016-08-16;http://www.ing.unal.edu.co/grupos/calidad_aire/;gica_fibogunal.edu.co;B con vigencia hasta 2019-12-05 - Convocatoria 781 de 2017;Ingeniería y Tecnología -- Ingeniería Ambiental;Ciencia, Tecnología e innovación en Ambiente, Biodiversidad y Hábitat;Investigaciones en Energía y Minería;Plan de trabajo 2016-20181. FormaciónEl grupo contribuirá a la apertura del Doctorado en Ciencias Ambientales y continuará la consolidación del Doctorado en Ingeniería Química, las Maestrías en Ingeniería Ambiental, Meteorología e Ingeniería Química de la Universidad Nacional de Colombia sede Bogotá y otros programas asociados en las diferentes sedes de la Universidad Nacional de Colombia.Se hará una evaluación de las asignaturas que los profesores del grupo actualmente activos están impartiendo y se propondrán reformas que sean necesarias.Se propondrán cursos de educación continuada y diplomados para fortalecer la formación de ingenieros y otros profesionales en temas de calidad del aire en el país.2. InvestigaciónEl grupo fortalecerá el equipamiento de laboratorio para investigación en calidad del aire, mediante proyectos apoyados por convocatorias internas de la Universidad Nacional así como mediante convenios con instituciones y convocatorias externas.Se estructurarán y presentarán proyectos para el Sistema Nacional de Regalías, con el fin de dar soporte al mejoramiento de los sistemas de gestión de calidad del aire en las regiones.El grupo continuará y expandirá su participación en redes internacionales de investigación y estructurará propuestas de investigación para presentarlas a convocatorias internacionales.Se espera vincular 1-2 estudiantes de doctorado por ańo en el periodo 2016-2018. Igualmente, se espera vincular y graduar alrededor de 6 estudiantes de maestría por ańo.Se continuará el fortalecimiento de los temas de investigación que se han desarrollado en los últimos 4 ańos y se empezará a hacer trabajo en captura de dióxido de carbono con una estudiante de doctorado.Finalmente, se generará un proceso editorial interno que permita terminar de editar artículos que están pendientes de sometimiento a revistas indexadas y generar una dinámica de producción de artículos más continua.;Las ciudades de Colombia se encuentran rezagadas en la investigación en calidad del aire con respecto a ciudades equivalentes alrededor del mundo. Se han realizado relativamente pocas caracterízaciones de material particulado que permitan asignar responsabilidades y definir prioridades claras en las medidas de prevención control de contaminación del aire, pues no se conocen las responsabilidades precisas por tipo de fuente. Por otro lado, los pocos estudios epidemiológicos que se han realizado no han tenido la continuidad suficiente ni han logrado el soporte institucional ni social necesario para exigir una mayor efectividad de las políticas de prevención y control de la contaminación del aire. La efectividad de las medidas que se han tomado para mejorar la movilidad y el entorno urbanos no ha sido medida con precisión, ni las organizaciones sociales han tomado en cuenta los análisis de beneficio/costo realizados por diversos autores.Todas estas necesidades de información requieren de un soporte científico que las líneas de investigación del Grupo Calidad del aire otorgará mediante el desarrollo de sus proyectos. La linea está en un proceso de desarrollo y adquisición de tecnologías duras y blandas que permitan obtener la información con la misma calidad de las investigaciones realizadas en otras latitudes en la actualidad. Esto incluye:- Caracterización completa del material particulado y aplicación de modelos de receptor para la determinación de la contribución de fuentes. La caracterización incluyendo su composición química, concentración másica, concentración en número de partícula, distribución de tamańo.- Determinación de los efectos de la contaminación del material particulado sobre la salud de la población en caso de partícular interés, como el cambio de sistemas de transporte de las ciudades.- Modelación de calidad del aire, para evaluar las políticas de prevención y control de la contaminación del aire.;El objetivo general del grupo de Calidad del Aire es generar el soporte científico necesario para el diseńo de políticas y estrategias efectivas para el mejoramiento de la calidad del aire en Bogotá y otros centros urbanos de Colombia.Objetivos específicos:- Determinar la contribución / responsabilidad de las fuentes de contaminantes al aire en ambientes urbanos.- Determinar la efectividad de medidas de prevención y control de emisiones de contaminantes del aire.- Determinar la relación contaminación - salud de la población.- Desarrollar inventarios de emisión y modelos de calidad del aire, para aplicarlos a la predicción de escenarios de descontaminación.- Generar recomendaciones de gestión de calidad del aire para Centros Urbanos en Colombia.- Desarrollar y evaluar tecnologías de prevención y control de la contaminación del aire.;Retos del grupo:1- Lograr el reconocimiento y una alta calificación de Colciencias en la próxima convocatoria de reconocimiento de grupos de investigación, mejorarlo y mantenerlo en las siguientes convocatorias.2- Generar convenios con instituciones gubernamentales involucradas con la problemática de calidad del aire, salud pública y producción y uso de combustibles, con el fin de desarrollar investigaciones que permitan diseńar sus políticas y estrategias de control de la contaminación del aire en Colombia.3- Publicar el nuevo conocimiento generado por el grupo en revistas del más alto impacto nacional e internacional.4. Liderar el avance científico en los aspectos de calidad del aire en Colombia5. Representar a la comunidad científica colombiana relacionada con calidad del aire en redes internacionales.;El grupo será reconocido como el mejor grupo de investigación en la problemática de la contaminación del aire, líder en la formación de profesionales que generen proyectos de alto impacto para el mejoramiento de la calidad del aire en Colombia.
COL0044036;2003;1;BOGOTÁ, D. C. - BOGOTÁ, D.C.;HECTOR CIFUENTES AYA;Si el día 2011-07-14;;hcifuentesaunal.edu.co;;Ingeniería y Tecnología -- Otras Ingenierías y Tecnologías;Ciencia, Tecnología e Innovación en Ingeniería;No Aplica;El programa de trabajo se realizará en tres grandes áreas:En primer lugar análisis, diseńo y desarrollo de metodologías sobre la eficacia, la eficiencia y la efectividad, aplicables a estudios de caso y análisis teóricos de competitividad y productividad en general. En segundo lugar el estudio, la evaluación, el monitoreo de la competitividad, productividad, transferencia, reconversión y modernización tecnológica en empresas, entidades del gobierno y cadenas productivas. En tercer lugar la reflexión teórica desde la perspectiva del pensamiento estratégico y realización de análisis prospectivos. PRINCIPALES ACTIVIDADES 1 Recopilación bibliográfica sobre los temas de la productividad y la competitividad en las organizaciones y las cadenas productivas. 2 Elaboración de metodologías de planeación, evaluación, gestión, control, monitoría y calidad de proyectos relacionados con aspectos de la tecnología, su desarrollo, gestión y procesos de transferencia. 3 Desarrollo de herramientas que apoyen la toma de decisiones para mejorar la productividad y competitividad a nivel nacional e internacional. 4 Estudios y asesorías específicas de competitividad y productividad en empresas y cadenas productivas. 5 Análisis de la realidad empresarial y realización de estudios prospectivos. 6 Elaboración y desarrollo de cursos y seminarios sobre competitividad, calidad productividad y temas afines.;null;1. Mejorar continuamente a partir del trabajo académico en aspectos investigativos relacionados con competitividad, calidad, productividad, eficiencia, eficacia y efectividad, la tecnología en las organizaciones y en las cadenas productivas. 2. Afianzar la cultura de investigación en la comunidad académica del programa de ingeniería industrial3. Integrar diferentes áreas del conocimiento en el planteamineto y desarrollo de proyectos de investigación4. Plantear soluciones a problemas locales, regionales, nacionales y/o internacionales en áreas relacionadas con la competitividad, productividad y calidad, a partir de los resultados de los proyectos de investigación5. Integrar el grupo de investigación con los programas de estudio de postgrado del programa de ingeniería industrial actuales y futuros;null;null
COL0046264;1998;2;BOGOTÁ, D. C. - BOGOTÁ, D.C.;JUAN EDILBERTO RINCON PARDO;Si el día 2012-11-14;;agrospectivaunal.edu.co;;Ingeniería y Tecnología -- Ingeniería Química;Ciencia, Tecnología e Innovación en Ingeniería;Ciencia, Tecnología e Innovación en Ciencias Agropecuarias;De acuerdo con las diferentes líneas de trabajo, se planean alcanzar los siguientes logros a futuro:Prospectiva tecnológica agroindustrialAdelantar estudios de prospectiva tecnológica para diferentes sectores agroindustriales del país, tales como sector yuquero, Farináceos, Panela y hortalizas trabajo que será adelantado conjuntamente con diversas entidades como CIAT, Clayuca, Ministerio de Comercio, Industria y Turismo, Ministerio de Agricultura. Prospectiva tecnológica para regiones estratégicas del Departamento de Cundinamarca. Trabajo a realizar con la gobernación de Cundinamarca.Gestión tecnología en agroindustriaDesarrollo de 4 seminarios de Diseńo en la cuarta generación. A realizar con el Ministerio de Comercio, Industria y Turismo. Colaborar con la formulación de planes y programas de ID universitarios en comunión con programas locales y regionales para el desarrollo tecnológico agroindustrial en sectores estratégicos, mediante el planteamiento de una Iniciativa nacional de Desarrollo tecnológico del Agro Colombiano. A realizar con el Ministerio de Comercio, Industria y Turismo.Diseńo de productos, procesos y equiposRealizar la implementación a nivel piloto de los diferentes adelantos tecnológicos alcanzados en el sector de almidones y glucoquímica. Adelantar investigaciones en el área de Deshidratación de productos agrícolas, especialmente, en el diseńo de secadores para la obtención de harinas de yuca y plátano. Para el logro de estas metas, se está actualmente trabajando en la gestión del apoyo institucional por parte de diferentes entidades gubernamentales, con quienes se tienen avances significativos, aunque aún se está en la fase de planeación.;El grupo de trabajo pertenece a la Facultad de Ingeniería de la Universidad Nacional de Colombia, Sede Bogotá, con la participación, fundamentalmente, de los Departamentos de Ingeniería Química y Mecánica y Mecatrónica, en el ańo de 1998. En sus inicios del grupo, realizó estudios para la identificación de sectores estratégicos con gran potencial para contribuir al desarrollo económico y social de distinta regiones de Colombia. Para el ańo 2004, se han logrado los siguientes avances: Endulzantes Naturales:Desarrollo de tres técnicas para la instantanización de panela: Foam Mat, Explosion Puff y Aglomeración, siendo esta última de fácil implementación a nivel de trapiches paneleros de capacidad media. Glucoquímica  Almidón de YucaDesarrollo de las técnicas para modificación en ruta seca de almidón de yuca, obtenido tres productos de alto valor  dextrinas adhesivas y reemplazantes de grasa - y modificación directa del almidón para panificación. Paralelamente se adelantó la fase de diseńo de los equipos necesarios en cada proceso. Alimentos ConvenientesSe adelantó un estudio de tendencias de consumo y de diseńo de alimentos de consumo masivo tanto internamente como a nivel mundial, identificándose los albores un importante macro-negocio en donde la agroindustria colombiana tiene grandes posibilidades tanto en el mercado interno como en el global. Resultado de esto se desarrollo la tecnología básica para la obtención de conservas de leguminosas de bajo costo  fríjol, lentejas  en empaque plástico. Con base en la experiencia ganada en el campo agroalimentario, durante el ańo 2004 el grupo adelantó un estudio prospectivo, en forma conjunta con el Ministerio de Industria, Comercio y Turismo, para determinar requerimientos futuros en diseńo de equipos para las mipymes agroindustriales. Con base en los resultados del estudio, se planea la realización de varios ejercicios de planeación estratégica y de gestión tecnológica y de ID. TRAYECTO;Adelantar estudios de prospectiva tecnológica, con énfasis en mipymes agroindustriales de sectores estratégicos del país, para orientar la formulación de planes y programas locales y regionales para el desarrollo de los sistemas productivos en diferentes comunidades, como parte de los procesos de construcción de su modernidadContribuir con elementos para la formulación de planes, programas y agendas regionales orientadas a la promoción del desarrollo tecnológico de las pequeńas y medianas empresas agroindustriales para su incursión en nuevos negocios, con productos o servicios de alto valor agregado y con proyección globalOrientar las acciones de investigación en ciencia y tecnología a nivel de universidades y centros de desarrollo tecnológico, hacia el desarrollo de plataformas tecnológicas y a la generación de conocimiento estratégico requerido para dar sostenibilidad a las diferentes fases del proceso de desarrollo de mipymes agroindustriales de sectores estratégicos. Aplicar las directrices establecidas por la prospectiva tecnológica - basada fundamentalmente en la metodología por objetivos del mapeo rutas tecnológicas Road Mapping  a la formulación de programas y proyectos de desarrollo tecnológico orientados al diseńo de productos y tecnologías de procesamiento requeridas para el desarrollo de las oportunidades identificadas en los nuevos negocios;Con base en los resultados de los estudios realizados, se planea la realización de varios ejercicios de planeación estratégica y de gestión tecnológica y de ID orientados hacia la búsqueda de formas efectivas de articulación del trabajo de ID adelantado en las universidades y CDTs con la industria y el gobierno para contribuir con el desarrollo tecnológico de la agroindustria en Colombia en diversos sectores estratégicos del país. Al respecto se están programando Talleres de Diseńo Integral - productos-procesos-equipos  dentro de sistemas de gestión tecnológica de cuarta generación  4G, con entes gubernamentales como el Ministerio de Comercio IT, Gobernación de Cundinamarca  MADR, y se planea adelantar ejercicios de prospectiva con Centros de investigación como el CIAT y Clayuca. Igualmente se planea continuar con la investigación en diseńo de procesos y equipos para los sectores estratégicos que determinan los estudios prospectivos, e implementar referentes comercialmente exitosos de las innovaciones planeadas.;Los diversos estudios, la opinión de expertos principalmente de otras latitudes y contextos, la políticas e instrumentos de política, actores claves de entidades relacionadas con el sector agroindustrial, comités y mesas de trabajo etc. son reiterativos en resaltar la imperiosa necesidad de adelantar procesos para promover el Desarrollo Agroindustrial del país. No obstante, hasta ahora, su principal aporte ha sido el conceptuar sobre el QUÉ debería hacerse pero, poco a nada sobre el POR QUÉ y el CÓMO, Esto es, en la definición clara de los impactos a corto, mediano y largo plazo, el despliegue de acciones, estrategias, metodologías y herramientas adecuadas para gestionar los procesos requeridos para avanzar en forma efectiva en la dirección de las realidades de Desarrollo Agroindustrial esperadas o deseadas. En razón de esta circunstancia, el Grupo AGROSPECTIVA ha centrado su accionar en la identificación del portafolio de proyectos estratégicos de ID+i, su secuenciación y articulación, asi como en las estrategias, tácticas y herramientas para gestionar con enfoque sistémico los procesos del desarrollo con base en iniciativas originadas en la base social de productores de un territorio. Se busca, mediante una adecuada gobernanza, adelantar los procesos tendientes a la construcción colectiva de las nuevas realidades del desarrollo en alianza con la academia y el estado.Al respecto, la metodología desarrollada por el grupo identifica las estrategias mas efectivas y la configuración mas adecuada del accionar para la gestión de los diferentes procesos del desarrollo, mediante la definición en forma colectiva de la Arquitectura del Desarrollo Territorial, en consonancia con los mas recientes enfoques para la Gestión del Desarrollo Productivo y Comercial con enfoque en innovaciones de AVA dentro de Sistemas de Gestión de Tecnología, ID de Cuarta Generación  4G.
